<?xml version="1.0"?>
<!--
To change this template, choose Tools | Templates
and open the template in the editor.
-->

<xs:schema version="1.0"
           xmlns:xs="http://www.w3.org/2001/XMLSchema"
           targetNamespace="http://www.companyInfoSchema.net"
           xmlns="http://www.companyInfoSchema.net"
           elementFormDefault="qualified">
    <xs:element name="companyInfo" type="listCompaniesType"/>
    <xs:complexType name="listCompaniesType">
        <xs:sequence>
            <xs:element name="companyInfo" type="companyInfoType" minOccurs="1" maxOccurs="unbounded"/>
        </xs:sequence>
    </xs:complexType>
    
    <xs:complexType name="companyInfoType">
        <xs:sequence>
           <xs:element name="companyCode" type="companyCodeType" minOccurs="1" maxOccurs="1"/>
           <xs:element name="companyName" type="companyNameType" minOccurs="1" maxOccurs="1"/>
           <xs:element name="telefonNumber" type="telefonNumberType" minOccurs="1" maxOccurs="1"/>
        </xs:sequence>
    </xs:complexType>
    
    <xs:simpleType name="companyCodeType">
        <xs:restriction base="xs:string">
            <xs:pattern value="[0-9]{5}" />
        </xs:restriction>
    </xs:simpleType>
    
    
    <xs:simpleType name="companyNameType">
        <xs:restriction base="xs:string">
            <xs:pattern value="[A-Za-z]+"/>
        </xs:restriction>
    </xs:simpleType>
    
    <xs:simpleType name="telefonNumberType">
        <xs:restriction base="xs:string">
            <xs:pattern value="[0-9]{10}" />
        </xs:restriction>
    </xs:simpleType>
    
</xs:schema>
