<?xml version="1.0" encoding="UTF-8"?>
<!--
To change this template, choose Tools | Templates
and open the template in the editor.
-->


<ns1:companyInfo
    xmlns:xsi='http://www.w3.org/2001/XMLSchema-instance'
    xmlns:ns1='http://www.companyInfoSchema.net'
    xsi:schemaLocation='http://www.companyInfoSchema.net companyInfoSchema.xsd'>
    <ns1:companyInfo>
        <ns1:companyCode>12345</ns1:companyCode>
        <ns1:companyName>KTH</ns1:companyName>
        <ns1:telefonNumber>4687906000</ns1:telefonNumber>
    </ns1:companyInfo>
    
    <ns1:companyInfo>
        <ns1:companyCode>54321</ns1:companyCode>
        <ns1:companyName>Ericsson</ns1:companyName>
        <ns1:telefonNumber>4610719000</ns1:telefonNumber>
    </ns1:companyInfo>
    
    <ns1:companyInfo>
        <ns1:companyCode>22222</ns1:companyCode>
        <ns1:companyName>SU</ns1:companyName>
        <ns1:telefonNumber>4610719001</ns1:telefonNumber>
    </ns1:companyInfo>
    
    <ns1:companyInfo>
    
        <ns1:companyCode>11111</ns1:companyCode>
        <ns1:companyName>Microsoft</ns1:companyName>
        <ns1:telefonNumber>4610719002</ns1:telefonNumber>
    </ns1:companyInfo>
</ns1:companyInfo>
    
    